<?xml version="1.0" encoding="UTF-8"?>
<!--============================================================================
    Copyright (c) 2007 Deutsche Post AG.
    All rights reserved. This program and the accompanying materials
    are made available under the terms of the Eclipse Public License v1.0
    which accompanies this distribution, and is available at
    http://www.eclipse.org/legal/epl-v10.html
    
    Contributors:
       Deutsche Post AG - initial API and implementation
 ============================================================================-->
<config xmlns:xsi="http://www.w3.org/2001/XMLSchema-instance" xsi:schemaLocation="http://schemas.sbb.org/sbb-conf/remote/SBB
C:\Daten\dpag\Schemas-TSP-config\done\sbb_conf_remotefallbackcfg.xsd">
	<Kernel name="default">
		<MinThreadCount>5</MinThreadCount>
		<MaxThreadCount>10</MaxThreadCount>
	</Kernel>
	<AuthorizationProcessor name="default">
		<ExpiryClearance>20</ExpiryClearance>
		<ClientExpiry>false</ClientExpiry>
		<ClientVerification>false</ClientVerification>
	</AuthorizationProcessor>
	<AuthenticationProcessor name="default">
		<UsernameTokenSupportOperation>
			<Operation value="seekBook"/>
		</UsernameTokenSupportOperation>
	</AuthenticationProcessor>
	<PolicyRouter name="default">
		<!-- Defines whether agreed policies should be checked for expiry -->
		<PolicyExpiryCheck>false</PolicyExpiryCheck>
		<!-- Grace period in seconds to consider when checking for policy expiry -->
		<PolicyExpiryGracePeriod>600</PolicyExpiryGracePeriod>
	</PolicyRouter>
	<PolicyResolver name="default">
		<PolicyMap>
			<Policy>
				<Key>FastAndFurious</Key>
				<Resource>consumer.ppdx</Resource>
			</Policy>
			<Policy>
				<Key>DefaultConsumerPolicy</Key>
				<Resource>consumer.ppdx</Resource>
			</Policy>
			<Policy>
				<Key>StandardPolicy</Key>
				<Resource>consumer.ppdx</Resource>
			</Policy>
		</PolicyMap>
		<DefaultPolicyName>StandardPolicy</DefaultPolicyName>
		<UseDefaultConsumerPolicy>true</UseDefaultConsumerPolicy>
		<DefaultConsumerPolicyName>DefaultConsumerPolicy</DefaultConsumerPolicyName>
	</PolicyResolver>
	<ContextStore name="default">
		<LdapURL>ldap://sopsparc08-5.servicebackbone.org:50389/o=sop.sbb.org</LdapURL>
		<LdapUser>cn=admin ,o=sop.sbb.org</LdapUser>
		<LdapPassword>secret</LdapPassword>
	</ContextStore>
</config>
